{
  "public_contract_version": "0.1",
  "intended_subject": {
    "subject_kind": "entity",
    "id": "thermal.energy_conservation"
  },
  "effect": {
    "subject": {
      "subject_kind": "entity",
      "id": "thermal.temperature_field"
    },
    "quality": "exact"
  },
  "comparison": "exact",
  "status": "pass"
}
