{
  "public_contract_version": "0.1",
  "intended_subject": {
    "subject_kind": "entity",
    "id": "thermal.energy_conservation"
  },
  "effect": {
    "subject": {
      "subject_kind": "entity",
      "id": "thermal.energy_conservation"
    },
    "quality": "unknown",
    "detail": "available evidence is insufficient"
  },
  "comparison": "unknown",
  "status": "indeterminate"
}
